{
  "metadata": {
    "id": "AD-002",
    "author": "OZ",
    "date": "2026-03-07",
    "version": "1.1",
    "title": "Render Y-Statements in YAML",
    "related": "AD-001"
  },
  "context": "\nY-statement ADRs need a concrete syntax that can be parsed and validated.\n",
  "facing": [
    "Effort to create and maintain",
    "Readability"
  ],
  "decided-for": "Yet another markup language (YAML)",
  "neglected": [
    "Plain text",
    "Markdown",
    "JSON"
  ],
  "to-achieve": [
    "A healthy balance between cost and benefit",
    "Being able to show something new",
    "Include those on the team who are familiar with \"YAML\""
  ],
  "accepting-that": [
    "AD consumers not familiar with YAML might complain"
  ],
  "additional-rationale": "technology exploration | increase visibility and community outreach"
}