{
  "metadata": {
    "id": "AD-001",
    "author": "OZ",
    "date": "2026-03-09",
    "version": "1.1",
    "title": "Use Y-Statements"
  },
  "context": "Need for an ADR template for our project; many exist",
  "facing": [
    "Effort to create and maintain",
    "Readability"
  ],
  "decided-for": "Y-Statements, in this new YAML template",
  "neglected": [
    "Nygardian ADRs",
    "MADR full or light",
    "others"
  ],
  "to-achieve": [
    "A healthy balance between cost and benefit",
    "Being able to show something new",
    "Include those on the team who are familiar with YAML"
  ],
  "accepting-that": [
    "Markdown/MADR guys have to be retrained (just a bit)"
  ],
  "additional-rationale": "\nADRs are great to have, many templates are suited. ADRs keep you CALM, see various blog posts <<https://medium.com/olzzio/y-statements-10eb07b5a177> and [\"Y-Statements --- A light template for architectural decision capturing\"](https://medium.com/olzzio/y-statements-10eb07b5a177) # optional\n"
}